Language,Title,Body,Sub-menu,Images,Path,Subtitle,Status
en,GarmentBox Support,support.html,,,support,"Problems aren't problems when you have knowkedgeable help. Plan ahead to keep your store available, attractive and effective."
en,GarmentBox Platform,hosting.html,menu-submenu-hosting,,garmentbox-platform
en,GarmentBox Platform,hosting_features.html,menu-submenu-hosting,,garmentbox-platform/features,Where Drupal Commerce stores thrive,0
en,GarmentBox Platform,hosting_howitworks.html,menu-submenu-hosting,,garmentbox-platform/how-it-works,What makes it so great?,0
en,Platform plans,hosting_plans.html,menu-submenu-hosting,,garmentbox-platform/hosting-plans,Say something meaningful about how this is way different than anything else.,0
en,Terms of Service,terms_of_service.html,,,terms-of-service
en,Not found,,,,not-found,Oops nothing to see out there !
en,Access denied,,,,access-denied,You are not authorized to access this page.
